"","Manuscript.Number","Author.Name","Article.Title","Article.Type","Current.Status","Status.Date","Initial.Date.Submitted","Review.Status","DOI","Short.Title","Keywords","Reviewers","Handling.Editor","Assigned.Editors","Country","is_China"
"51","PNMC-D-22-00054","Maxim Ublinskiy (RUSSIAN FEDERATION)","The effect of acetylsalicylic acid on the intensity of BOLD signal in human visual cortex during video stimulation. fMRI study.","Article","Revise","13 Oct 2022","13 Sep 2022","3 Complete; 0 Partial Review Saved; 28 Declined",NA,"","","Peter Herman * ; Cheryl A. Olman * ; Wietske van der Zwaag *","Sankari Gireesa","Chen Ding","RUSSIAN FEDERATION","Overseas"
"50","PNMC-D-22-00055R3","Shifang Ren (CHINA)","α2,3- S ialylation with F ucosylation associated with more severe anti-MDA5 positive Dermatomyositis induced by Rapidly progressive interstitial lung disease","Article","Final Decision Accept","18 Jan 2023","25 Sep 2022","",NA,"","","Eiji Miyoshi ; Sara Remuzgo-Martínez ; Albert Selva-O'Callaghan ; Eiji Miyoshi ; Albert Selva-O'Callaghan","Sankari Gireesa","Chen Ding","CHINA","China"
"49","PNMC-D-22-00056R1","Weisheng Xu (CHINA)","Formate Might be a Novel Potential Serum Metabolic Biomarker for Type 2 Diabetic Peripheral Neuropathy","Article","Revise","03 Apr 2023","02 Oct 2022","2 Complete; 0 Partial Review Saved; 1 Declined",NA,"","","Department of Endocrinology and Metabolism ; Leonor Puchades-Carrasco ; Valeria Righi ; Leonor Puchades-Carrasco * ; Valeria Righi *","Sankari Gireesa","Chen Ding","CHINA","China"
"48","PNMC-D-22-00057R2","Jiucun Wang (CHINA)","Quantitative assessment of ultraviolet-induced erythema and tanning responses in the Han Chinese population","Article","Final Decision Accept","15 Mar 2023","07 Oct 2022","",NA,"","","Carolyn J. Heckman ; Wei Liu ; Marty O. Visscher ; Wei Liu ; Marty O. Visscher","Sankari Gireesa","Chen Ding","CHINA","China"
"47","PNMC-D-22-00058R1","Jiaxing Tian (CHINA)","Investigation on Phenomics of traditional Chinese medicine from the diabetes","Review","Revise","28 Apr 2023","08 Oct 2022","2 Complete; 0 Partial Review Saved; 10 Declined",NA,"","","Dayue Darrel Duan, M.D., Ph.D. ; Zhijun Xie ; Vincent Yeung, Ph.D. ; changsheng dong * ; Yi-Chang Su, Ph.D., M.D *","Sankari Gireesa","Chen Ding","CHINA","China"
"46","PNMC-D-22-00059R1","Gang Liu (CHINA)","Recent advances in reference materials and standards for measurements in phenomics","Review","Under Review","21 Apr 2023","02 Nov 2022","1 Complete; 0 Partial Review Saved; 2 Agreed; 3 Declined; 1 Late",NA,"","","Hendrik Emons, PhD, DSc ; liang li ; zhijia ye ; Hua-Jun He * ; liang li * ; Sergey Prokunin *","Chen Ding","Chen Ding","CHINA","China"
"45","PNMC-D-22-00060","Alessandra Ferrandino (ITALY)","Morpho-chemical diversity of grapevine leaves from Iran","Article","Final Decision Reject","01 Dec 2022","02 Nov 2022","5 Complete; 0 Partial Review Saved; 26 Declined",NA,"","","Susana Boso * ; Darko Preiner * ; Luis Gonzaga Santesteban * ; Iva Šikuten * ; Seyed Mehdi Talebi *","Sankari Gireesa","Chen Ding","ITALY","Overseas"
"44","PNMC-D-22-00061R3","Yun Liu (CHINA)","A Common Functional Variant at the Enhancer of the Rheumatoid Arthritis Risk Gene ORMDL3 Regulates Its Expression through Allele-Specific JunD Binding","Article","Final Decision Accept","30 Mar 2023","01 Nov 2022","",NA,"","","Kerstin Klein ; bo wen ; Xiaolei Zhang ; Kerstin Klein ; bo wen ; Xiaolei Zhang","Sankari Gireesa","Chen Ding","CHINA","China"
"43","PNMC-D-22-00062R5","Xiang Li (AUSTRIA)","Performance of 18F-DCFPyL PET/CT in primary prostate cancer diagnosis, Gleason grading and D'Amico classification: A radiomics-based study","Article","Final Decision Accept","15 Apr 2023","01 Nov 2022","",NA,"","","jie ding ; Paola Mapelli ; Alessandro Stefano ; jie ding ; Paola Mapelli ; Alessandro Stefano ; Paola Mapelli ; Alessandro Stefano","Sankari Gireesa","Chen Ding","AUSTRIA","Overseas"
"42","PNMC-D-22-00063R1","Haijian Wang (CHINA)","Amyotrophic lateral sclerosis and risk of colorectal cancer: Mendelian randomization interrogation of causality and mediation","Article","Reviewers Assigned","26 Apr 2023","11 Nov 2022","3 Invited - No Response",NA,"","","wuqing Huang ; Daniela Mariosa ; Yiqiang Zhan ; wuqing Huang * ; Daniela Mariosa * ; Yiqiang Zhan *","Chen Ding","Chen Ding","CHINA","China"
"41","PNMC-D-22-00064R1","Daru Lu (CHINA)","Proteomics screen identified HMGA1 as a potential regulator to mediate γ-globin upregulation in response to reduced β-globin","Article","Final Decision Reject","24 Apr 2023","13 Nov 2022","3 Complete; 0 Partial Review Saved",NA,"","","Beate Hagl ; Chutima Kumkhaek ; Sjaak philipsen ; Beate Hagl * ; Chutima Kumkhaek * ; Sjaak philipsen *","Sankari Gireesa","Huiru Tang, PhD","CHINA","China"
"40","PNMC-D-22-00065R2","Zhipeng Xu (CHINA)","The role of secure computing environment in the International Human Phenome Project for the collaborative scientific research.","Brief Communication","Reviewers Assigned","30 Apr 2023","15 Nov 2022","19 Invited - No Response; 6 Declined",NA,"","","Susan E. Wallace ; Weiyi Xia ; Susan E. Wallace ; Weiyi Xia ; Haiwen Chen * ; B. Dong * ; Yongkai Fan * ; Jun Hou * ; Hao Jiang * ; Xia Lei * ; Dongmei Li * ; Jie Li * ; J. Liu * ; Linhua Ma * ; Songzhu Mei * ; Bin Ren * ; Chunzhi Wang * ; Yanyan Xu * ; Shichang Xuan * ; Keping Yu * ; Jun Zhang * ; Lin Zhang * ; Tiantian Zhang *","Chen Ding","Chen Ding","CHINA","China"
"39","PNMC-D-22-00066R3","Jianping Jia (CHINA)","Genetic phenotypes of Alzheimer’s disease: mechanisms and potential therapy","Review","Final Decision Accept","02 Feb 2023","16 Nov 2022","",NA,"","","George Perry, PhD ; Jintai Yu ; George Perry, PhD ; Jintai Yu","Sankari Gireesa","Chen Ding","CHINA","China"
"38","PNMC-D-22-00067R1","Menghan Hu (CHINA)","Auxiliary Diagnosis of Papillary Thyroid Carcinoma Based on Spectral Phenotype","Article","Revise","26 Apr 2023","18 Nov 2022","1 Complete; 0 Partial Review Saved",NA,"","","Berrin Çetinarslan ; Evert F. S. van Velsen, Ph.D., M.D., MSc ; Evert F. S. van Velsen, Ph.D., M.D., MSc *","Sankari Gireesa","Chen Ding","CHINA","China"
"37","PNMC-D-22-00068R1","weicheng chen (CHINA)","Next Generation Sequencing-Based Copy Number Variation Analysis in Chinese Patients with Primary Ciliary Dyskinesia Revealed Novel DNAH5 Copy Number Variations","Article","Revise","26 Apr 2023","20 Nov 2022","3 Complete; 0 Partial Review Saved; 6 Declined",NA,"","","Wan-Ping Lee ; Rolando A. R. Villacis ; Julia Wallmeier ; Wan-Ping Lee * ; Liling Qian * ; Rolando A. R. Villacis *","Sankari Gireesa","Chen Ding","CHINA","China"
"36","PNMC-D-22-00069R2","Cuiwei Yang (CHINA)","Deep neural network-estimated heart age as a predictor of cardiovascular disease among a large population: a study protocol for a retrospective trial (HPCD-LP)","Protocol","Reviews Completed","27 Apr 2023","24 Nov 2022","2 Complete; 0 Partial Review Saved; 3 Agreed; 19 Declined",NA,"","","David Harmon ; Kai Noponen ; Julia Ramirez ; Roberto L. Avitia * ; Daniel Cuevas-González * ; Jefferson Luiz Brum Marques * ; Julia Ramirez * ; Omprakash Yadav *","Chen Ding","Chen Ding","CHINA","China"
"35","PNMC-D-22-00070R2","Zhiyuan Hu (CHINA)","A Proactive Intervention Study in Metabolic Syndrome High-Risk Populations Using Phenome-Based Actionable P4 Medicine Strategy","Article","Under Review","23 Apr 2023","29 Nov 2022","1 Agreed",NA,"","","Shangyu Hong ; Kijin Kim ; Bin Zhao, Ph.D. ; Shangyu Hong ; Kijin Kim ; Bin Zhao, Ph.D. ; Kijin Kim *","Chen Ding","Chen Ding","CHINA","China"
"34","PNMC-D-22-00071R1","Weimin Ye (CHINA)","Inflammation as a mediator of microbiome-dysbiosis-associated DNA methylation changes in gastric premalignant lesions","Article","Under Review","18 Apr 2023","03 Dec 2022","1 Complete; 0 Partial Review Saved; 1 Agreed",NA,"","","Chol-Hee Jung ; Haitao Wang ; Chol-Hee Jung * ; Haitao Wang *","Chen Ding","Chen Ding","CHINA","China"
"33","PNMC-D-22-00072R1","yumei li (CHINA)","Pan-cancer analysis and immunohistochemistry validation identifies the oncogenic and prognostic role of EMG1","Article","Final Decision Reject","14 Feb 2023","18 Dec 2022","4 Complete; 0 Partial Review Saved; 4 Declined",NA,"","","Enrico Capobianco * ; Ming Jiang * ; Shengda Lin * ; Ting Qi *","Sankari Gireesa","Chen Ding ; Weimin Ye","CHINA","China"
"32","PNMC-D-22-00073R1","Jie Chen (CANADA)","A Multimodal Approach for Detection and Assessment of Depression Using Text, Audio and Video","Article","Revise","25 Apr 2023","23 Dec 2022","2 Complete; 0 Partial Review Saved",NA,"","","Sadiq Hussain ; Chiranjibi Sitaula ; Elena Tutubalina ; Sadiq Hussain * ; Elena Tutubalina *","Sankari Gireesa","Chen Ding","CANADA","Overseas"
"31","PNMC-D-22-00074R1","Jiangping Song (CHINA)","PLN gene variant (p.R14del)–related arrhythmogenic right ventricular cardiomyopathy has left ventricular involvement and heart failure progresses rapidly","Article","Revise","02 Mar 2023","22 Dec 2022","3 Complete; 0 Partial Review Saved",NA,"","","Yu An * ; Hong Guo * ; Yifei Li *","Chen Ding","Chen Ding ; Min-Dian Li, Ph.D.","CHINA","China"
"30","PNMC-D-22-00075R1","Jie Chen (CANADA)","Fluid-structure interaction analysis endorses ascending aortic length as a surgical indication for thoracic aortic aneurysm","Article","Under Review","11 Apr 2023","23 Dec 2022","2 Complete; 0 Partial Review Saved; 1 Agreed; 7 Declined; 1 Late",NA,"","","Doran Mix ; Paul Schoenhagen ; Ashutosh Hardikar * ; Doran Mix * ; Paul Schoenhagen *","Chen Ding","Chen Ding","CANADA","Overseas"
"29","PNMC-D-22-00076R2","Zhihong Li (CHINA)","3D Models of Sarcomas: The Next-generation Tool for Personalized Medicine","Review","Reviews Completed","30 Apr 2023","23 Dec 2022","2 Complete; 0 Partial Review Saved; 1 Declined",NA,"","","Steven D. Forsythe, Ph.D ; Gi Seok Jeong ; Chih-Hsun Lin ; Steven D. Forsythe, Ph.D * ; Gi Seok Jeong *","Chen Ding","Chen Ding","CHINA","China"
"28","PNMC-D-22-00077","Lin Miao (CHINA)","Aprepitant inhibits the development and metastasis of gallbladder cancer via ROS and MAPK activation","Article","Final Decision Withdrawn","19 Jan 2023","27 Dec 2022","19 Declined",NA,"","","","","Chen Ding","CHINA","China"
"27","PNMC-D-22-00078","Xuerui Tan (CHINA)","The role of CD147 N-glycosylation in atherosclerosis: protocol of a population-based case-control study followed by a laboratory-based functional investigation","Protocol","Final Decision Withdrawn","20 Feb 2023","24 Dec 2022","",NA,"","","","Chen Ding","Chen Ding ; Boon-Peng Hoh","CHINA","China"
"26","PNMC-D-22-00079","Xuerui Tan (CHINA)","Thumbs Down on Dizzying Direct-to-Consumer Genetic Testing","Commentary","Final Decision Reject","28 Jan 2023","25 Dec 2022","3 Complete; 0 Partial Review Saved; 23 Declined",NA,"","","Charles Dupras * ; Jianbo Jian * ; Hallam Stevens *","Sankari Gireesa","Chen Ding","CHINA","China"
"25","PNMC-D-23-00001","Yalin Wang (CHINA)","FNIRS brain network dynamics reveal cognitive function variability during acute high-altitude exposure","Article","Revise","22 Mar 2023","06 Feb 2023","2 Complete; 0 Partial Review Saved; 9 Declined",NA,"","","Saideh Ferdowsi * ; Anil Kamat *","Chen Ding","Chen Ding ; Luke Whiley","CHINA","China"
"24","PNMC-D-23-00002","Vajagathali Mohammed (INDIA)","Zebrafish as an influential model organism to investigate various human diseases: Current status and future perspectives","Review","Final Decision Reject","03 Feb 2023","10 Jan 2023","2 Complete; 0 Partial Review Saved; 20 Declined",NA,"","BNRC-D-23-00017","Stephan C.F. Neuhauss * ; Uwe Strähle *","Sankari Gireesa","Chen Ding","INDIA","Overseas"
"23","PNMC-D-23-00003R1","Jing Wu (CHINA)","The Critical Role of the Shroom Family Proteins in Morphogenesis, Organogenesis and Disease","Review","Incomplete","29 Mar 2023","29 Jan 2023","",NA,"","","David Pei-Cheng Lin, Ph.D. ; Nayden G. Naydenov ; Deli Yu, Ph.D.","","","CHINA","China"
"22","PNMC-D-23-00004R1","Bing Su (CHINA)","High arterial oxygen saturation in the acclimatized lowlanders living at high altitude","Brief Communication","Under Review","28 Apr 2023","01 Feb 2023","1 Complete; 0 Partial Review Saved; 1 Invited - No Response",NA,"","","Junxiang Chen ; Xianbo Zuo ; Junxiang Chen * ; Xianbo Zuo *","Xianyong Yin","Chen Ding ; Xianyong Yin","CHINA","China"
"21","PNMC-D-23-00005","Jianhua Huang (CHINA)","Energy-Phenotype-Paradigm: A New Interpretation of the Foundation of the Theory of Traditional Chinese Medicine","Review","Final Decision Reject","08 Feb 2023","05 Feb 2023","",NA,"","","","Sankari Gireesa","Chen Ding","CHINA","China"
"20","PNMC-D-23-00006","Desheng Sun (CHINA)","Synergistically augmenting cancer immunotherapy by physical manipulation of pyroptosis induction","Review","Revise","17 Apr 2023","08 Feb 2023","3 Complete; 0 Partial Review Saved; 5 Declined",NA,"","","Haocai Chang * ; Erxi Wu * ; Xiao-Yong Zhang, Ph.D. *","Sankari Gireesa","Chen Ding","CHINA","China"
"19","PNMC-D-23-00007","Rongjia Su (CHINA)","Single-Cell RNA-Sequencing Analysis Reveals Divergent Transcriptome Events between Platinum-sensitive and Platinum-Resistant High-Grade Serous Ovarian Carcinoma","Article","Final Decision Withdrawn","29 Apr 2023","11 Feb 2023","2 Complete; 0 Partial Review Saved; 5 Declined",NA,"","","Fengbiao Miao * ; Chuan Xu, Ph.D *","Sankari Gireesa","Chen Ding ; Yang Liu","CHINA","China"
"18","PNMC-D-23-00008","Huan Song (CHINA)","Risk of cardiovascular disease after common psychiatric disorders: analyses of disease susceptibility and progression trajectory in the UK Biobank","Article","Revise","22 Mar 2023","15 Feb 2023","3 Complete; 0 Partial Review Saved; 18 Declined",NA,"","","Alexandra Gillett * ; Giorgio Pistis * ; Denis Plotnikov *","Sankari Gireesa","Chen Ding","CHINA","China"
"17","PNMC-D-23-00009","Xin-Qiang Wu (CHINA)","Calumenin Is a Prognostic Biomarker That Correlates With Cell Malignancy and the Tumor Microenvironment in Clear Cell Renal Cell Carcinoma","Article","Revise","03 Apr 2023","16 Feb 2023","2 Complete; 0 Partial Review Saved; 15 Declined",NA,"","","Somchai Chutipongtanate * ; Chien-Feng Li *","Sankari Gireesa","Chen Ding","CHINA","China"
"16","PNMC-D-23-00010R3","Li Jin (CHINA)","De novo dissecting the three-dimensional facial morphology of 2,379 Han Chinese individuals","Article","Final Decision Accept","18 Apr 2023","04 Mar 2023","",NA,"","","Chao Chen ; Boon-Peng Hoh ; Dandan Zhang, Ph.D. ; Chao Chen ; Boon-Peng Hoh ; Dandan Zhang, Ph.D.","Sankari Gireesa","Chen Ding","CHINA","China"
"15","PNMC-D-23-00011","Cong Li (CHINA)","Visualizing Macrophage Phenotypes and Polarization in Diseases: From Biomarkers to Molecular Probes","Review","Revise","17 Apr 2023","11 Mar 2023","2 Complete; 0 Partial Review Saved; 12 Declined",NA,"","","Hung-Jen Chen, M.D., Ph.D. * ; Beiyan Zhou *","Sankari Gireesa","Chen Ding","CHINA","China"
"14","PNMC-D-23-00012","Yanfeng Jiang (CHINA)","Circulating lipoproteins mediate the association between cardiovascular risk factors and cognitive decline: a community-based cohort study","Article","Revise","20 Apr 2023","14 Mar 2023","2 Complete; 0 Partial Review Saved; 16 Declined",NA,"","","Peng Li, Ph.D. * ; Huan Song, Ph.D.， M.D. *","Sankari Gireesa","Chen Ding","CHINA","China"
"13","PNMC-D-23-00013","Luciano Pinheiro da Silva (BRAZIL)","INDIVIDUAL EGG-LAYING RECORDING FROM MULTIPLE-QUAIL CAGES USING EGG FEATURES THROUGH MACHINE LEARNING","Article","Final Decision Reject","30 Mar 2023","15 Mar 2023","",NA,"","","","Sankari Gireesa","Chen Ding","BRAZIL","Overseas"
"12","PNMC-D-23-00014","Huiru Tang (CHINA)","Simultaneous Quantification of 50 Fatty Acids within 8 Minutes for Molecular Phenotyping Multiple Biological Samples Using Gas-Chromatography Coupled with Flame Ionization Detection and Mass Spectrometry (GC-FID/MS)","Article","Final Decision Reject","18 Apr 2023","30 Mar 2023","2 Complete; 0 Partial Review Saved; 23 Declined",NA,"","","Thomas D. Donald Horvath, PhD * ; Sergey Tumanov *","Sankari Gireesa","Chen Ding","CHINA","China"
"11","PNMC-D-23-00015","Peng Luo (CHINA)","Mutation of the mannose binding pathway leads to improved chemosensitivity in small cell lung cancer associating with decreased cancer associated fibroblasts","Article","Final Decision Reject","11 Apr 2023","27 Mar 2023","2 Complete; 0 Partial Review Saved; 3 Declined",NA,"","","Chien-Hsiu Li * ; Yue Zhao, M.D. & Ph.D. *","Sankari Gireesa","Chen Ding","CHINA","China"
"10","PNMC-D-23-00016","NINGNING Liu (CHINA)","Oral microbiota: a new insight into cancer progression, diagnosis and treatment","Review","Reviewers Assigned","25 Apr 2023","02 Apr 2023","1 Complete; 0 Partial Review Saved; 1 Invited - No Response; 13 Declined",NA,"","","Bin Cheng * ; Chia-Cheng Li *","Chen Ding","Chen Ding","CHINA","China"
"9","PNMC-D-23-00017","Tieliu Shi (CHINA)","Reconstructing rare disease classification with the integration of systems-level molecular data and phenotypic data","Article","Reviewers Assigned","17 Apr 2023","07 Apr 2023","",NA,"","","","Jose Arturo Molina-Mora","Chen Ding ; Jose Arturo Molina-Mora, Ph.D.","CHINA","China"
"8","PNMC-D-23-00018","Longjiang Zhang (CHINA)","Artificial Intelligence Empowered Nuclear Medicine and Molecular Imaging in Cardiology","Review","Reviewers Assigned","24 Apr 2023","11 Apr 2023","",NA,"","","","Fengtao Liu","Chen Ding ; Fengtao Liu, M.D., Ph.D.","CHINA","China"
"7","PNMC-D-23-00019","Jiaxue Wu (CHINA)","Identification of poly(ADP-ribose) polymerase 9 (PARP9) as a potent suppressor for Mycobacterium tuberculosis infection","Article","Under Review","21 Apr 2023","16 Apr 2023","1 Complete; 1 Partial Review Saved; 1 Agreed; 7 Declined",NA,"","","qiang chen * ; linyu lu * ; Avinash Padhi *","Chen Ding","Chen Ding","CHINA","China"
"6","PNMC-D-23-00020","Yan Zheng (CHINA)","Kidney function and cardiovascular disease: evidence from observational studies and Mendelian randomization analyses","Article","Under Review","20 Apr 2023","16 Apr 2023","1 Complete; 0 Partial Review Saved; 1 Agreed",NA,"","","Lianmin Chen * ; Hiajian Sun *","Peng Li","Chen Ding ; Peng Li, Ph.D.","CHINA","China"
"5","PNMC-D-23-00021","Guanghui Liu (CHINA)","Multimodal omics approaches to aging and age-related diseases","Review","Under Review","25 Apr 2023","18 Apr 2023","3 Agreed; 4 Declined",NA,"","","Dijun Chen * ; jingjing wang * ; Tu Zhidong *","Chuan Xu","Chen Ding ; Chuan Xu, Ph.D","CHINA","China"
"4","PNMC-D-23-00022","Cuiwei Yang (CHINA)","Risk analysis of atrial fibrillation based on ECG phenotypes: The RAF-ECP study protocol","Protocol","Under Review","26 Apr 2023","18 Apr 2023","2 Agreed; 14 Declined",NA,"","","Shivaram P Arunachalam * ; Goran Krstačić *","Chen Ding","Chen Ding","CHINA","China"
"3","PNMC-D-23-00023","Weiqiang Zhang (CHINA)","The Investigation of Correlations between Speech and Voice Phenotyping and TCM Constitution: A Methodologic Innovation for Developing Chinmedphenomics","Article","Sent Back to Author","24 Apr 2023","22 Apr 2023","",NA,"","","","","","CHINA","China"
"2","PNMC-D-23-00024","Huan Song (CHINA)","Disease modules associated with unfavorable sleep patterns and their genetic determinants: A prospective cohort study of the UK Biobank","Article","Under Review","30 Apr 2023","25 Apr 2023","3 Agreed; 19 Invited - No Response; 6 Declined",NA,"","","Jong Bhak * ; Haoyan Chen * ; Myungguen Chung * ; Xue Gao * ; Hee-Jin Im * ; Peilin Jia * ; Bong-Jo Kim * ; Hyung-Lae Kim * ; Jeong-Hyun Kim * ; Sangsoo Kim * ; Toshihiro Kishikawa * ; Soonil Kwon * ; Byungwook Lee * ; Mulin Jun Li * ; Ikuko N. Motoike * ; Soichi Ogishima * ; Bumhee Park * ; Jun Wan * ; Minxian Wang * ; Henry Sung-Ching Wong * ; Jin Ok Yang * ; Kwang Ik Yang *","Chen Ding","Chen Ding","CHINA","China"
"1","PNMC-D-23-00025","Wanwan Hou (CHINA)","Plasma-free samples for transcriptomic analysis: a potential alternative to whole blood samples","Article","Editor Assigned","29 Apr 2023","27 Apr 2023","",NA,"","","","Samantha Lodge","Chen Ding ; Samantha Lodge, PhD","CHINA","China"
